{
  "$schema": "schema/vendor.schema.json",
  "uuid": "5ed255d1-8e44-4667-aa39-c61e731ea782",
  "target": "basic",
  "title": "Школьная лаборатория",
  "description": "Школьная лаборатория - программно-аппаратный комплекс, для проведения лабораторных испытаний",
  "vendor": {
    "title": "Бастион",
    "logo": "img/logos/basic/logo.svg"
  },
  "labs": {
    "items": [
      {
        "uuid": "5101"
      },
      {
        "uuid": "5102"
      },
      {
        "uuid": "5103"
      },
      {
        "uuid": "5104"
      },
      {
        "uuid": "51C0"
      },
      {
        "uuid": "51C1"
      },
      {
        "uuid": "51C2"
      }
    ],
    "exclude": ["5104"]
  }
}
