{
  "$schema": "schema/vendor.schema.json",
  "uuid": "20c321be-01bf-43d5-8951-a856ad884250",
  "target": "polylab",
  "title": "Полилаб",
  "description": "Полилаб - программно-аппаратный комплекс, для проведения лабораторных испытаний",
  "vendor": {
    "title": "Полимедиа",
    "logo": "img/logos/polylab/logo.svg"
  },
  "labs": {
    "items": [
      {
        "uuid": "5101",
        "color": "#017BC2",
        "title": "Естествознание СШ тип 2"
      },
      {
        "uuid": "5101",
        "color": "#017BC2",
        "title": "Математика"
      },
      {
        "uuid": "5102",
        "color": "#009E96",
        "title": "Естествознание НШ тип 1"
      },
      {
        "uuid": "5102",
        "color": "#009E96",
        "title": "Естествознание СШ тип 1"
      },
      {
        "uuid": "5103",
        "color": "#8BC34A",
        "title": "Естествознание НШ тип 2"
      },
      {
        "uuid": "5103",
        "color": "#8BC34A",
        "title": "География"
      },
      {
        "uuid": "5103",
        "color": "#8BC34A",
        "title": "ОБЖ"
      }
    ],
    "exclude": ["5104", "51C0", "51C1", "51C2"]
  }
}
